### ISSUE TITLE
Native stack: cannot find sent record in _tcbs.

### ISSUE THREAD

**Issue by lelelelelez** [scylladb/seastar#749]
When I benchmark ceph crimson messenger using `perf_crimson_msgr`, the client use native network stack and 1 job(i.e. shard 1 send TCP SYN packet). The received SYN+ACK packet may be hashed to another shard which does not have corresponding record in _tcbs struc. This bug will cause TCP handshake failure.

The tcpdump output is:
15:21:47.400523 IP 192.168.122.111.53010 > 192.168.122.122.distinct: Flags [S], seq 2210197188, win 29200, options [mss 1460,wscale 7,eol], length 0
15:21:47.400735 IP 192.168.122.122.distinct > 192.168.122.111.53010: Flags [S.], seq 2180376672, ack 2210197189, win 29200, options [mss 1460,wscale 7,eol], length 0
15:21:47.401020 IP 192.168.122.111.53010 > 192.168.122.122.distinct: Flags [R.], seq 1, ack 1, win 0, length 0
