### ISSUE TITLE
Native stack send out-of-order packet

### ISSUE THREAD

**Issue by ikarishinjieva** [scylladb/seastar#91]
Scenario:
1.Client connect to server with Native stack
2.Server accept(), and send a packet after the accept, like 
```
listener->accept().then((fd){
    fd.write(packet).then({fd.flush()})
})
```
3.Found out-of-order packet, tcpdump output:
```
11:13:30.955190 IP 172.18.19.109.54739 > 172.18.19.113.1234: Flags [S], seq 3341037203, win 29200, options [mss 1460,sackOK,TS val 668966991 ecr 0,nop,wscale 7], length 0
11:13:30.957286 IP 172.18.19.113.1234 > 172.18.19.109.54739: Flags [S.], seq 2625307275, ack 3341037204, win 29200, options [mss 1460,wscale 7,eol], length 0
11:13:30.957359 IP 172.18.19.109.54739 > 172.18.19.113.1234: Flags [.], ack 1, win 229, length 0
11:13:30.957368 IP 172.18.19.113.1234 > 172.18.19.109.54739: Flags [S.], seq 2625307275:2625307347, ack 3341037204, win 29200, options [mss 1460,wscale 7,eol], length 72
11:13:30.957378 IP 172.18.19.109.54739 > 172.18.19.113.1234: Flags [.], ack 1, win 229, length 0
11:13:31.968319 IP 172.18.19.113.1234 > 172.18.19.109.54739: Flags [.], seq 1:72, ack 1, win 29200, length 71
11:13:31.968393 IP 172.18.19.109.54739 > 172.18.19.113.1234: Flags [.], ack 72, win 229, length 0
11:13:31.968421 IP 172.18.19.109.54739 > 172.18.19.113.1234: Flags [F.], seq 1, ack 72, win 229, length 0
11:13:31.968970 IP 172.18.19.113.1234 > 172.18.19.109.54739: Flags [.], ack 2, win 29200, length 0
11:13:31.969080 IP 172.18.19.113.1234 > 172.18.19.109.54739: Flags [F.], seq 73, ack 2, win 29200, length 0
11:13:31.969109 IP 172.18.19.109.54739 > 172.18.19.113.1234: Flags [R], seq 3341037205, win 0, length 0
```
The 4th packet is a data packet, with SYN and with duplicate seq.

**Comment by avikivity** [comment]
@asias

**Comment by unknownzerx** [comment]
It is confirmed that the problem has gone in recent version of seastar.

**Comment by asias** [comment]
@unknownzerx Thanks!
